{"batch_reselection_performed":false,"batches":[{"anchor_symbol_ids":["S1-4784a4e37af48b97743bc9ed","S1-4cd634d97556e8bdc7d18bcb","S1-5ceceb4c9cf975eeb8dcbf6f","S1-7710c97ef63c32da48ac1cc2","S1-8a44ff026ce0b0a5e39cec45","S1-adec3b59447c98d3f501cd53","S1-b7079f811d5b274347e8c732","S1-c7ff70c8054ad947e2bb0195","S1-def48ebe3a74f55a9e6da13e"],"batch_id":"B1-d8bec1825c46b4928e28a4d8","call_ids":["E1-2dc324b283e8b8293f60352b","E1-3687ea03595dc304e486f21c","E1-8afa96873a33b4e3ea75d67b","E1-ae0bc27ab4998185ab479e3d","E1-ca96455102a655c2e12b92ab"],"chunk_ids":["C1-30540df656352f8bbd9461db","C1-a1135e7454b6aa8407e50f81","C1-b7efeb3afee3e2e06eb3095e","C1-0ad575c8c0c68bad7daf8030","C1-2f5eab8499b22ceb5e3ca29e","C1-52011ef66e558e62c7e9d9e4","C1-cb4cb3641eee856436bb8fe0","C1-84e23fd1b57f1aa2d17265c6","C1-b361be98bc84bc2dfd5822c3","C1-a0aa32b855b11dc19ba09610","C1-d79da71c27793432033fb787"],"chunks_without_supported_facts":["C1-a1135e7454b6aa8407e50f81","C1-b361be98bc84bc2dfd5822c3"],"enclosing_symbol_ids":["S1-4784a4e37af48b97743bc9ed","S1-4cd634d97556e8bdc7d18bcb","S1-5ceceb4c9cf975eeb8dcbf6f","S1-7710c97ef63c32da48ac1cc2","S1-8a44ff026ce0b0a5e39cec45","S1-adec3b59447c98d3f501cd53","S1-b7079f811d5b274347e8c732","S1-c7ff70c8054ad947e2bb0195","S1-def48ebe3a74f55a9e6da13e"],"include_ids":["I1-14a2dd258c41fa3a6d8292b8","I1-57e862b3f3faf324c4b95cc3","I1-787489f1f9a41e6ad9b6de97","I1-97cdd3ce6d1ea04b5ef1b019","I1-a5ada18fede7a085a2020cee","I1-b165ec4b36574e337accd25d","I1-d6864c40a565b8ca358d2921","I1-db32ca082d3c2de9098bf621","I1-e8244d93046363302b018464"],"payload_utf8_bytes":8055,"rank":1},{"anchor_symbol_ids":["S1-626b7dd6c3413a33cc6917cc","S1-c0bf770b42fd2d78e228d78d"],"batch_id":"B1-796c24f794f5ac477aa37e7b","call_ids":[],"chunk_ids":["C1-3c608e9ba7a018efc93ccc69","C1-feb7ef4a64d270d230c44bdb","C1-9f2e61acc611fabb11d59c5d"],"chunks_without_supported_facts":["C1-3c608e9ba7a018efc93ccc69","C1-feb7ef4a64d270d230c44bdb"],"enclosing_symbol_ids":["S1-626b7dd6c3413a33cc6917cc","S1-c0bf770b42fd2d78e228d78d"],"include_ids":[],"payload_utf8_bytes":8088,"rank":2},{"anchor_symbol_ids":[],"batch_id":"B1-6b18bf00c3dee1007743063a","call_ids":[],"chunk_ids":["C1-cbb914a52ec5bf376d91c613","C1-3d60043462d6ea1ca6a1a821"],"chunks_without_supported_facts":["C1-cbb914a52ec5bf376d91c613","C1-3d60043462d6ea1ca6a1a821"],"enclosing_symbol_ids":[],"include_ids":[],"payload_utf8_bytes":6454,"rank":3}],"index_contract_sha256":"2d3f028a63615dad8c2f7620079ca36964137d1ec88ddc6ffa72592a22c78b8c","schema_version":1,"selected_batch_ids":["B1-d8bec1825c46b4928e28a4d8","B1-796c24f794f5ac477aa37e7b","B1-6b18bf00c3dee1007743063a"],"selection_order_preserved":true,"selection_seed":20260811,"selection_sha256":"79d60a8f10aeed2cbadf8f1859a042cd8342484af653d50874a7e5d879df3b49"}
